{
  "id": "WEB-EXT-003",
  "type": "external_reference",
  "title": {
    "it": "Condanna Natland per complotto omicida Foxtrot nel Regno Unito"
  },
  "publisher": "UK Crown Prosecution Service",
  "files": [],
  "urls": [
    "https://www.cps.gov.uk/national-news/news/teen-hitman-guilty-uk-murder-plot"
  ],
  "cited_in": [
    "S07"
  ],
  "review": {
    "status": "imported_unreviewed",
    "notes": []
  },
  "provenance": [
    {
      "file": "sources/original/Fonte_07_Ragnatela_Attori_Interessi_Relazioni_Europa_2026-10-21_nuove_evidenze.csv",
      "row": 3,
      "original": {
        "id": "EXT-003",
        "date_start": "2026-10-16",
        "title": "Condanna Natland per complotto omicida Foxtrot nel Regno Unito",
        "description": "CPS aggiorna il 16 ottobre la condanna a 20 anni per un tentativo di omicidio su commissione nel marzo 2025; il singolo ordine iraniano non è dimostrato nel caso.",
        "publisher": "UK Crown Prosecution Service",
        "url": "https://www.cps.gov.uk/national-news/news/teen-hitman-guilty-uk-murder-plot",
        "evidence_level": "E1",
        "in_source_06": "no"
      }
    }
  ]
}
